[
    {
        "id": "003",
        "formId": "e28aa7aa-1d5f-11e0-b929-000c29ad1d07",
        "label": "VITAIS - ADULTO",
        "url": "/vitals/adult",
        "minOccur": "0",
        "maxOccur": "-1",
        "constraints": {
            "minAge": "15"
        },
        "markedOn": "283e551d-a470-4280-84fd-8f409f3caf7a"
    },
    {
        "id": "004",
        "formId": "e28ac028-1d5f-11e0-b929-000c29ad1d07",
        "label": "VITAIS - PEDIATRIA",
        "url": "/vitals/child",
        "minOccur": "0",
        "maxOccur": "-1",
        "constraints": {
            "maxAge": "14"
        },
        "markedOn": "283e551d-a470-4280-84fd-8f409f3caf7a"
    },
    {
        "id": "006",
        "formId": "e28aa7aa-1d5f-11e0-b929-000c29ad1d07",
        "label": "OMS ESTADIO - ADULTO",
        "url": "/oms/adult",
        "minOccur": "0",
        "maxOccur": "-1",
        "constraints": {
            "minAge": "15",
            "requireChekin": true
        },
        "markedOn": "2afd6fda-3003-4a68-bfa2-9a4e2ab2773d"
    },
    {

        "id": "007",
        "formId": "65896366-17b2-4c3e-9cce-440edcfe7b4e",
        "label": "ASPECTOS RELEVANTES",
        "url": "/story",
        "minOccur": "0",
        "maxOccur": "-1",
        "constraints": {
            "requireChekin": true
        }
    },
    {
        "id": "008",
        "formId": "e28aa7aa-1d5f-11e0-b929-000c29ad1d07",
        "label": "ANAMNESE E EXAME FÍSICO - ADULTO",
        "url": "/anamnese/adult",
        "minOccur": "0",
        "maxOccur": "-1",
        "constraints": {
            "minAge": "15",
            "requireChekin": true
        },
        "markedOn": "3ae77ecc-865b-4354-abf9-901f36715c70"
    },
     {
        "id": "010",
        "formId": "e28ac028-1d5f-11e0-b929-000c29ad1d07",
        "label": "ANAMNESE E EXAME FÍSICO - PEDIATRIA",
        "url": "/anamnese/child",
        "minOccur": "0",
        "maxOccur": "-1",
        "constraints": {
            "maxAge": "14",
            "requireChekin": true
        },
        "markedOn": "3ae77ecc-865b-4354-abf9-901f36715c70"
    },
    {
        "id": "009",
        "formId": "e28aa7aa-1d5f-11e0-b929-000c29ad1d07",
        "label": "DIAGNOSTICO - ADULTO",
        "url": "/diagnostics/adult",
        "minOccur": "0",
        "maxOccur": "-1",
        "constraints": {
            "minAge": "15",
            "requireChekin": true
        },
        "markedOn": "4bea5235-1ef3-45a3-a7de-c33850c74422"
    },
    {
        "id": "011",
        "formId": "e28ac028-1d5f-11e0-b929-000c29ad1d07",
        "label": "DIAGNOSTICO - PEDIATRIA",
        "url": "/diagnostics/child",
        "minOccur": "0",
        "maxOccur": "-1",
        "constraints": {
            "maxAge": "14",
            "requireChekin": true
        },
        "markedOn": "4bea5235-1ef3-45a3-a7de-c33850c74422"
    }

]
