[
    {
        "id": "001",
        "formId": "e28b6096-1d5f-11e0-b929-000c29ad1d07",
        "label": "INFO SOCIAL - ADULTO",
        "url": "/anamnesis/a/adult",
        "minOccur": "1",
        "maxOccur": "-1",
        "constraints": {
            "minAge": "15",
            "requireChekin": false
        }
    },
    {
        "id": "002",
        "formId": "e28b6b0e-1d5f-11e0-b929-000c29ad1d07",
        "label": "INFO SOCIAL - PEDIATRIA",
        "url": "/anamnesis/a/child",
        "minOccur": "1",
        "maxOccur": "1",
        "constraints": {
            "maxAge": "14",
            "requireChekin": false
        }
    }
]